{
  "$schema": "https://json-schema.org/draft/2020-12/schema",
  "$id": "https://research-auto.local/schemas/github-smoke-manifest.schema.json",
  "title": "GitHub Smoke Manifest",
  "type": "object",
  "additionalProperties": false,
  "required": [
    "manifest_version",
    "source",
    "adapter_version",
    "target_valid_records",
    "max_items_per_author",
    "repositories",
    "request",
    "retry",
    "compliance_ref",
    "compliance_hash",
    "compliance_decision"
  ],
  "properties": {
    "manifest_version": {"type": "string", "pattern": "^[0-9]+\\.[0-9]+\\.[0-9]+$"},
    "source": {"const": "github"},
    "adapter_version": {"type": "string", "pattern": "^[0-9]+\\.[0-9]+\\.[0-9]+$"},
    "target_valid_records": {"const": 10},
    "max_items_per_author": {"const": 2},
    "repositories": {
      "type": "array",
      "minItems": 2,
      "items": {
        "type": "object",
        "additionalProperties": false,
        "required": ["name", "quota"],
        "properties": {
          "name": {"type": "string", "pattern": "^[A-Za-z0-9_.-]+/[A-Za-z0-9_.-]+$"},
          "quota": {"type": "integer", "minimum": 1}
        }
      }
    },
    "request": {
      "type": "object",
      "additionalProperties": false,
      "required": ["endpoint", "state", "sort", "direction", "per_page", "max_pages_total", "max_requests"],
      "properties": {
        "endpoint": {"const": "/repos/{owner}/{repo}/issues"},
        "state": {"const": "open"},
        "sort": {"const": "created"},
        "direction": {"const": "desc"},
        "per_page": {"type": "integer", "minimum": 1, "maximum": 100},
        "max_pages_total": {"type": "integer", "minimum": 1},
        "max_requests": {"type": "integer", "minimum": 1}
      }
    },
    "retry": {
      "type": "object",
      "additionalProperties": false,
      "required": ["max_retries", "base_backoff_seconds", "max_backoff_seconds"],
      "properties": {
        "max_retries": {"type": "integer", "minimum": 0},
        "base_backoff_seconds": {"type": "number", "minimum": 0},
        "max_backoff_seconds": {"type": "number", "minimum": 0}
      }
    },
    "compliance_ref": {"const": "compliance/github.json"},
    "compliance_hash": {"type": "string", "pattern": "^[a-f0-9]{64}$"},
    "compliance_decision": {"const": "conditional"}
  }
}
